{
  "schemaVersion": 3,
  "origin": "viper",
  "name": "Tin HiFi T2 ParametricEQ",
  "masterEnable": true,
  "source": "autoeq-oratory1990",
  "sourceName": "Tin HiFi T2 ParametricEQ.txt",
  "route": "headset",
  "masterLimiter": {
    "outputVolume": 100,
    "channelPan": 0,
    "threshold": 100
  },
  "playbackGainControl": {
    "enable": false,
    "strength": 100,
    "maxGain": 100,
    "outputThreshold": 100
  },
  "lufs": {
    "enable": false,
    "target": 140,
    "maxGain": 60,
    "speed": 1
  },
  "fetCompressor": {
    "enable": false,
    "threshold": 0,
    "ratio": 100,
    "kneeAuto": true,
    "knee": 0,
    "kneeMulti": 0,
    "gainAuto": true,
    "gain": 0,
    "attackAuto": true,
    "attack": 20,
    "maxAttack": 80,
    "releaseAuto": true,
    "release": 50,
    "maxRelease": 100,
    "crest": 100,
    "adapt": 50,
    "noClip": true
  },
  "multibandCompressor": {
    "enable": false,
    "bandEnables": "1;1;1;1;1",
    "crossovers": "120;500;4000;8000",
    "thresholds": "-18;-18;-18;-18;-18",
    "ratios": "50;50;50;50;50",
    "gains": "24;24;24;24;24",
    "knees": "0;0;0;0;0",
    "kneeMultis": "0;0;0;0;0",
    "attacks": "1;1;1;1;1",
    "maxAttacks": "44;44;44;44;44",
    "releases": "100;100;100;100;100",
    "maxReleases": "200;200;200;200;200",
    "crests": "100;100;100;100;100",
    "adapts": "50;50;50;50;50",
    "kneeAutos": "1;1;1;1;1",
    "gainAutos": "1;1;1;1;1",
    "attackAutos": "1;1;1;1;1",
    "releaseAutos": "1;1;1;1;1",
    "noClips": "1;1;1;1;1"
  },
  "ddc": {
    "enable": false,
    "device": ""
  },
  "spectrumExtension": {
    "enable": false,
    "strength": 7600,
    "exciter": 0
  },
  "equalizer": {
    "enable": true,
    "bandCount": 10,
    "bands": [
      -0.19329862369470163,
      -1.9742083662548664,
      -6.833266912307328,
      -9.133835110742364,
      -7.99738120440336,
      -6.135789726185291,
      -2.5063139564215664,
      -4.104761951806491,
      -5.1391715784397025,
      -8.21552363258952
    ],
    "presetId": null
  },
  "dynamicEq": {
    "enable": false,
    "bandCount": 3,
    "freqs": "60;150;400",
    "qs": "100;100;150",
    "gains": "0;0;0",
    "thresholds": "-200;-200;-200",
    "attacks": "10;10;10",
    "releases": "100;100;100",
    "filterTypes": "0;0;0"
  },
  "convolver": {
    "enable": false,
    "kernelFile": "",
    "crossChannel": 0
  },
  "fieldSurround": {
    "enable": false,
    "widening": 0,
    "midImage": 5,
    "depth": 0
  },
  "diffSurround": {
    "enable": false,
    "delay": 5,
    "reverse": false,
    "wetDryMix": 100,
    "lpCutoff": 0
  },
  "stereoImager": {
    "enable": false,
    "lowWidth": 100,
    "midWidth": 100,
    "highWidth": 100,
    "lowCrossover": 200,
    "highCrossover": 4000
  },
  "headphoneSurround": {
    "enable": false,
    "quality": 0
  },
  "reverb": {
    "enable": false,
    "roomSize": 0,
    "width": 0,
    "damp": 0,
    "wet": 0,
    "dry": 50
  },
  "dynamicSystem": {
    "enable": false,
    "presetId": null,
    "device": 0,
    "strength": 50,
    "xLow": 100,
    "xHigh": 5600,
    "yLow": 40,
    "yHigh": 80,
    "sideGainLow": 50,
    "sideGainHigh": 50
  },
  "psychoacousticBass": {
    "enable": false,
    "cutoff": 80,
    "intensity": 50,
    "harmonicOrder": 3,
    "originalLevel": 100
  },
  "bass": {
    "enable": false,
    "mode": 0,
    "frequency": 55,
    "gain": 50,
    "antiPop": true
  },
  "bassMono": {
    "enable": false,
    "mode": 0,
    "frequency": 55,
    "gain": 50,
    "antiPop": true
  },
  "clarity": {
    "enable": false,
    "mode": 0,
    "gain": 50
  },
  "cure": {
    "enable": false,
    "crossfeedPreset": 0
  },
  "tubeSimulator": {
    "enable": false
  },
  "analogX": {
    "enable": false,
    "mode": 0
  },
  "speakerCorrection": {
    "enable": false
  },
  "sourcePreampDb": -6.1,
  "sourceFilters": [
    {
      "type": "LSC",
      "fcHz": 105.0,
      "gainDb": 6.3,
      "q": 0.7
    },
    {
      "type": "PK",
      "fcHz": 218.0,
      "gainDb": -3.4,
      "q": 0.35
    },
    {
      "type": "PK",
      "fcHz": 2000.0,
      "gainDb": 4.0,
      "q": 0.65
    },
    {
      "type": "PK",
      "fcHz": 1237.0,
      "gainDb": -1.7,
      "q": 1.79
    },
    {
      "type": "PK",
      "fcHz": 38.0,
      "gainDb": 0.5,
      "q": 3.51
    },
    {
      "type": "HSC",
      "fcHz": 10000.0,
      "gainDb": -2.3,
      "q": 0.7
    },
    {
      "type": "PK",
      "fcHz": 6122.0,
      "gainDb": 3.1,
      "q": 2.02
    },
    {
      "type": "PK",
      "fcHz": 5155.0,
      "gainDb": -4.4,
      "q": 5.66
    },
    {
      "type": "PK",
      "fcHz": 2237.0,
      "gainDb": 0.6,
      "q": 4.35
    },
    {
      "type": "PK",
      "fcHz": 2935.0,
      "gainDb": -1.1,
      "q": 5.29
    }
  ],
  "sourceText": "Preamp: -6.1 dB\nFilter 1: ON LSC Fc 105 Hz Gain 6.3 dB Q 0.70\nFilter 2: ON PK Fc 218 Hz Gain -3.4 dB Q 0.35\nFilter 3: ON PK Fc 2000 Hz Gain 4.0 dB Q 0.65\nFilter 4: ON PK Fc 1237 Hz Gain -1.7 dB Q 1.79\nFilter 5: ON PK Fc 38 Hz Gain 0.5 dB Q 3.51\nFilter 6: ON HSC Fc 10000 Hz Gain -2.3 dB Q 0.70\nFilter 7: ON PK Fc 6122 Hz Gain 3.1 dB Q 2.02\nFilter 8: ON PK Fc 5155 Hz Gain -4.4 dB Q 5.66\nFilter 9: ON PK Fc 2237 Hz Gain 0.6 dB Q 4.35\nFilter 10: ON PK Fc 2935 Hz Gain -1.1 dB Q 5.29\n"
}
