{
  "schemaVersion": 3,
  "origin": "viper",
  "name": "game_v2",
  "masterEnable": true,
  "source": "viper-v2",
  "sourceName": "game_v2.json",
  "route": "headset",
  "masterLimiter": {
    "threshold": 100,
    "outputVolume": 100,
    "channelPan": 0
  },
  "playbackGainControl": {
    "enable": true,
    "strength": 225,
    "maxGain": 300,
    "outputThreshold": 75
  },
  "lufs": {
    "enable": false,
    "target": 140,
    "maxGain": 60,
    "speed": 1
  },
  "fetCompressor": {
    "enable": true,
    "threshold": -18,
    "ratio": 50,
    "kneeAuto": true,
    "knee": 0,
    "kneeMulti": 0,
    "gainAuto": true,
    "gain": 0,
    "attackAuto": true,
    "attack": 20,
    "maxAttack": 80,
    "releaseAuto": true,
    "release": 50,
    "maxRelease": 100,
    "crest": 100,
    "adapt": 50,
    "noClip": true
  },
  "multibandCompressor": {
    "enable": false,
    "bandEnables": "1;1;1;1;1",
    "crossovers": "120;500;4000;8000",
    "thresholds": "-18;-18;-18;-18;-18",
    "ratios": "50;50;50;50;50",
    "gains": "24;24;24;24;24",
    "knees": "0;0;0;0;0",
    "kneeMultis": "0;0;0;0;0",
    "attacks": "1;1;1;1;1",
    "maxAttacks": "44;44;44;44;44",
    "releases": "100;100;100;100;100",
    "maxReleases": "200;200;200;200;200",
    "crests": "100;100;100;100;100",
    "adapts": "50;50;50;50;50",
    "kneeAutos": "1;1;1;1;1",
    "gainAutos": "1;1;1;1;1",
    "attackAutos": "1;1;1;1;1",
    "releaseAutos": "1;1;1;1;1",
    "noClips": "1;1;1;1;1"
  },
  "ddc": {
    "enable": false,
    "device": ""
  },
  "spectrumExtension": {
    "enable": false,
    "strength": 7600,
    "exciter": 0
  },
  "equalizer": {
    "enable": true,
    "bandCount": 10,
    "bands": [
      -1.0,
      0.0,
      1.0,
      2.0,
      3.0,
      5.0,
      6.0,
      5.0,
      3.0,
      0.0
    ],
    "presetId": null
  },
  "dynamicEq": {
    "enable": false,
    "bandCount": 3,
    "freqs": "60;150;400",
    "qs": "100;100;150",
    "gains": "0;0;0",
    "thresholds": "-200;-200;-200",
    "attacks": "10;10;10",
    "releases": "100;100;100",
    "filterTypes": "0;0;0"
  },
  "convolver": {
    "enable": false,
    "kernelFile": "",
    "crossChannel": 0
  },
  "fieldSurround": {
    "enable": true,
    "widening": 5,
    "midImage": 8,
    "depth": 4
  },
  "diffSurround": {
    "enable": false,
    "delay": 5,
    "reverse": false,
    "wetDryMix": 100,
    "lpCutoff": 0
  },
  "stereoImager": {
    "enable": true,
    "lowWidth": 100,
    "midWidth": 130,
    "highWidth": 130,
    "lowCrossover": 200,
    "highCrossover": 4000
  },
  "headphoneSurround": {
    "enable": false,
    "quality": 0
  },
  "reverb": {
    "enable": true,
    "roomSize": 2,
    "width": 2,
    "damp": 4,
    "wet": 8,
    "dry": 75
  },
  "dynamicSystem": {
    "enable": true,
    "presetId": null,
    "device": 0,
    "strength": 35,
    "xLow": 600,
    "xHigh": 5400,
    "yLow": 60,
    "yHigh": 105,
    "sideGainLow": 10,
    "sideGainHigh": 20
  },
  "psychoacousticBass": {
    "enable": false,
    "cutoff": 80,
    "intensity": 50,
    "harmonicOrder": 3,
    "originalLevel": 100
  },
  "bass": {
    "enable": true,
    "mode": 2,
    "frequency": 55,
    "gain": 300,
    "antiPop": true
  },
  "bassMono": {
    "enable": false,
    "mode": 0,
    "frequency": 55,
    "gain": 50,
    "antiPop": true
  },
  "clarity": {
    "enable": true,
    "mode": 2,
    "gain": 150
  },
  "cure": {
    "enable": false,
    "crossfeedPreset": 0
  },
  "tubeSimulator": {
    "enable": false
  },
  "analogX": {
    "enable": false,
    "mode": 0
  },
  "speakerCorrection": {
    "enable": false
  }
}
